{
  "$schema": "https://json-schema.org/draft/2020-12/schema",
  "title": "AegisWeft Agent",
  "type": "object",
  "additionalProperties": false,
  "required": [
    "kind",
    "id",
    "version",
    "name",
    "purpose",
    "responsibilities",
    "inputs",
    "outputs",
    "skills",
    "toolAccess",
    "approvalRequiredFor",
    "instruction"
  ],
  "properties": {
    "kind": {
      "const": "agent"
    },
    "id": {
      "type": "string",
      "pattern": "^[a-z0-9]+(?:-[a-z0-9]+)*$"
    },
    "version": {
      "type": "string"
    },
    "name": {
      "type": "string"
    },
    "purpose": {
      "type": "string"
    },
    "responsibilities": {
      "type": "array",
      "items": {
        "type": "string"
      }
    },
    "inputs": {
      "type": "array",
      "items": {
        "type": "string"
      }
    },
    "outputs": {
      "type": "array",
      "items": {
        "type": "string"
      }
    },
    "skills": {
      "type": "array",
      "items": {
        "type": "string"
      }
    },
    "toolAccess": {
      "type": "array",
      "items": {
        "type": "string"
      }
    },
    "approvalRequiredFor": {
      "type": "array",
      "items": {
        "type": "string"
      }
    },
    "instruction": {
      "type": "string"
    }
  }
}
