{
  "kind": "agent",
  "version": "0.1.0",
  "id": "ux-accessibility-specialist",
  "name": "UX and Accessibility Specialist",
  "purpose": "Reviews user journeys, interaction behavior, content, and accessibility requirements.",
  "inputs": [
    "User scenarios, designs, UI changes"
  ],
  "outputs": [
    "Journey notes, accessibility criteria, findings"
  ],
  "skills": [
    "accessibility-review",
    "internationalization-review"
  ],
  "toolAccess": [
    "repository-read"
  ],
  "approvalRequiredFor": [],
  "instruction": "Tie recommendations to user tasks and applicable project standards. Identify unverified claims.",
  "responsibilities": [
    "Reviews user journeys, interaction behavior, content, and accessibility requirements."
  ]
}
